,start,end,text,label,score,sentiment
155,699.0,703.0, Such policies would take time to implement and have their effects.,NEGATIVE,0.9904237389564514,"{'label': 'NEGATIVE', 'score': 0.9904237389564514}"
156,703.0,710.0," For the near term, a moderation of labor demand growth will be required to restore balance to the labor market.",NEGATIVE,0.9603342413902283,"{'label': 'NEGATIVE', 'score': 0.9603342413902283}"
157,710.0,715.0," Currently, the unemployment rate is at 3.7% near 50 years.",NEGATIVE,0.9959067106246948,"{'label': 'NEGATIVE', 'score': 0.9959067106246948}"
158,715.0,718.0, Loads and job openings exceed available workers by about 4 million.,NEGATIVE,0.9261502027511597,"{'label': 'NEGATIVE', 'score': 0.9261502027511597}"
159,718.0,723.0, That is about 1.7 job openings for every person looking for work.,NEGATIVE,0.9142017960548401,"{'label': 'NEGATIVE', 'score': 0.9142017960548401}"
160,723.0,728.0," So far, we've seen only tentative signs of a moderation in labor demand.",NEGATIVE,0.9987062215805054,"{'label': 'NEGATIVE', 'score': 0.9987062215805054}"
161,728.0,739.0," With slower GDP growth this year, job gains have stepped down for more than 450,000 per month over the first seven months of the year to about 290,000 per month over the past three months.",NEGATIVE,0.9912249445915222,"{'label': 'NEGATIVE', 'score': 0.9912249445915222}"
162,739.0,748.0," But this job growth remains far in excess of the pace needed to accommodate population growth over time, about 100,000 per month by many estimates.",NEGATIVE,0.9892205595970154,"{'label': 'NEGATIVE', 'score': 0.9892205595970154}"
163,748.0,756.0," Job openings have now fallen by about a million and a half this year, but remain higher than at any time before the pandemic.",POSITIVE,0.9747690558433533,"{'label': 'POSITIVE', 'score': 0.9747690558433533}"
164,756.0,760.0, Wage growth too shows only tentative signs of returning to balance.,NEGATIVE,0.9985566735267639,"{'label': 'NEGATIVE', 'score': 0.9985566735267639}"
165,760.0,773.0," Some measures of wage growth have ticked down recently, but the declines are very modest so far relative to earlier increases and still leave wage growth well above levels consistent with 2% inflation over time.",POSITIVE,0.7855721712112427,"{'label': 'POSITIVE', 'score': 0.7855721712112427}"
166,773.0,782.0," To be clear, strong wage growth is a good thing, but for wage growth to be sustainable, it needs to be consistent with 2% inflation.",NEGATIVE,0.9975663423538208,"{'label': 'NEGATIVE', 'score': 0.9975663423538208}"
167,782.0,789.0, So let's then sum up this review of economic conditions that we think we need to see to bring inflation down to 2%.,NEGATIVE,0.9779223203659058,"{'label': 'NEGATIVE', 'score': 0.9779223203659058}"
168,789.0,795.0, Work growth and economic activity has slowed to well below its longer run trend and this needs to be sustained.,NEGATIVE,0.9958142638206482,"{'label': 'NEGATIVE', 'score': 0.9958142638206482}"
169,795.0,802.0, Bottle next in goods production are easing and goods price inflation appears to be easing as well and this too must continue.,NEGATIVE,0.9924448132514954,"{'label': 'NEGATIVE', 'score': 0.9924448132514954}"
170,802.0,815.0," Housing services inflation will probably keep rising well into next year, but if inflation on new leases continues to fall, we will likely see housing services inflation begin to fall later next year.",NEGATIVE,0.9985981583595276,"{'label': 'NEGATIVE', 'score': 0.9985981583595276}"
171,815.0,825.0," So we're going to leave the labor market, which is especially important for inflation in core services ex housing, again accounting for more than half of the category.",NEGATIVE,0.9993283748626709,"{'label': 'NEGATIVE', 'score': 0.9993283748626709}"
172,825.0,833.0, Show is only tentative signs of rebalancing and wage growth remains well above levels that would be consistent with 2% inflation over time.,NEGATIVE,0.974212646484375,"{'label': 'NEGATIVE', 'score': 0.974212646484375}"
173,833.0,839.0," So despite some promising developments, we have a long way to go in restoring price stability.",NEGATIVE,0.9962233304977417,"{'label': 'NEGATIVE', 'score': 0.9962233304977417}"
174,839.0,845.0," According to monetary policy, my FOMC colleagues and I are strongly committed to restoring price stability.",POSITIVE,0.9989854693412781,"{'label': 'POSITIVE', 'score': 0.9989854693412781}"
175,845.0,857.0," After our November meeting, we noted that we anticipated that ongoing rate increases will be appropriate in order to attain a policy stance that is sufficiently restrictive to move inflation down to 2% over time.",NEGATIVE,0.9834860563278198,"{'label': 'NEGATIVE', 'score': 0.9834860563278198}"
176,857.0,873.0," Monetary policy affects the economy and inflation with uncertain legs and the full effects of our rapid tightening so far are yet to be felt. Thus, it makes sense to moderate the pace of our rate increases as we approach the level of restraint that will be sufficient to bring inflation down.",NEGATIVE,0.9880865812301636,"{'label': 'NEGATIVE', 'score': 0.9880865812301636}"
177,873.0,879.0, The time for moderating the pace of rate increases may come as soon as the December meeting.,NEGATIVE,0.9962330460548401,"{'label': 'NEGATIVE', 'score': 0.9962330460548401}"
178,879.0,889.0," In our progress in tightening policy, the timing of that moderation is far less significant than the questions of how much further we will need to raise rates to control inflation.",NEGATIVE,0.9997338652610779,"{'label': 'NEGATIVE', 'score': 0.9997338652610779}"
179,889.0,893.0, And the length of time that will be necessary to hold policy at a restrictive level.,NEGATIVE,0.9903505444526672,"{'label': 'NEGATIVE', 'score': 0.9903505444526672}"
180,893.0,899.0, It is likely that restoring price stability will require holding policy at a restrictive level for some time.,NEGATIVE,0.9970040917396545,"{'label': 'NEGATIVE', 'score': 0.9970040917396545}"
181,899.0,904.0, History caution strongly against prematurely loosening policy.,NEGATIVE,0.8694027662277222,"{'label': 'NEGATIVE', 'score': 0.8694027662277222}"
182,904.0,912.0, And I'll close by saying that we will.,POSITIVE,0.9997584223747253,"{'label': 'POSITIVE', 'score': 0.9997584223747253}"
